{
  "version": 1,
  "generated_for": "health-002",
  "last_checked_at": "2026-07-08",
  "registry_reference": "projects/health/artifacts/registries/philippines-health-coverage-registry.json",
  "scope_note": "Seed catalog for Philippines health coverage literacy workflows. This is a category-level extraction surface, not a complete plan database.",
  "advice_boundary": "Educational workflow data only. This catalog does not provide medical advice, insurance advice, legal advice, financial advice, claims decisions, coverage determinations, rankings, or purchase recommendations.",
  "sources": [
    {
      "source_id": "philhealth-benefits-page",
      "source_type": "public-payer",
      "title": "PhilHealth Benefits",
      "url": "https://www.philhealth.gov.ph/benefits/",
      "authority_level": "official",
      "last_checked_at": "2026-07-08",
      "notes": "Official PhilHealth benefit categories and benefit mechanics page."
    },
    {
      "source_id": "ic-hmo-product-circular-2017-19",
      "source_type": "regulator",
      "title": "Insurance Commission Circular Letter 2017-19 on HMO products and forms",
      "url": "https://www.insurance.gov.ph/wp-content/uploads/2022/09/CL2017_19.pdf",
      "authority_level": "official",
      "last_checked_at": "2026-07-08",
      "notes": "Official HMO product definition, product contract, and benefit-category source."
    },
    {
      "source_id": "maxicare-plans",
      "source_type": "provider",
      "title": "Maxicare Plans",
      "url": "https://www.maxicare.com.ph/maxicare-plans/",
      "authority_level": "provider-published",
      "last_checked_at": "2026-07-08",
      "notes": "Provider-published product surface for individual/family, MSME, corporate, prepaid, and emergency-oriented Maxicare products."
    },
    {
      "source_id": "medicard-healthcare-programs",
      "source_type": "provider",
      "title": "MediCard Healthcare Packages",
      "url": "https://www.medicardphils.com/healthcare-programs/",
      "authority_level": "provider-published",
      "last_checked_at": "2026-07-08",
      "notes": "Provider-published package archive for MediCard individual, family, SME, corporate, and emergency products."
    },
    {
      "source_id": "medicard-hero",
      "source_type": "provider",
      "title": "MediCard H.E.R.O. Health Emergency Response On-demand",
      "url": "https://www.medicardphils.com/healthcare-programs/medicard-h-e-r-o-health-emergency-response-on-demand/",
      "authority_level": "provider-published",
      "last_checked_at": "2026-07-08",
      "notes": "Provider-published emergency response product surface."
    },
    {
      "source_id": "philcare-services",
      "source_type": "provider",
      "title": "PhilCare Services",
      "url": "https://philcare.com.ph/services",
      "authority_level": "provider-published",
      "last_checked_at": "2026-07-08",
      "notes": "Provider-published service surface for PhilCare Health LUXE and related coverage categories."
    },
    {
      "source_id": "aia-health-products",
      "source_type": "insurer",
      "title": "AIA Philippines Health Products",
      "url": "https://www.aia.com.ph/en/our-products/health",
      "authority_level": "provider-published",
      "last_checked_at": "2026-07-08",
      "notes": "Provider-published health product category page for AIA Philippines."
    },
    {
      "source_id": "sunlife-health-protection",
      "source_type": "insurer",
      "title": "Sun Life Philippines Health Protection Products",
      "url": "https://www.sunlife.com.ph/en/insurance/health-protection/",
      "authority_level": "provider-published",
      "last_checked_at": "2026-07-08",
      "notes": "Provider-published health protection product category page."
    },
    {
      "source_id": "prulife-health-products",
      "source_type": "insurer",
      "title": "Pru Life UK Health Products",
      "url": "https://www.prulifeuk.com.ph/en/products/health/",
      "authority_level": "provider-published",
      "last_checked_at": "2026-07-08",
      "notes": "Provider-published health product category page."
    }
  ],
  "regulatory_patterns": [
    {
      "pattern_id": "hmo-product-regulatory-baseline",
      "applies_to_entity_type": "hmo",
      "pattern_name": "HMO Product Regulatory Baseline",
      "coverage_tags": [
        "inpatient",
        "outpatient",
        "emergency",
        "preventive",
        "dental",
        "maternity",
        "diagnostic",
        "provider-network",
        "cashless-access"
      ],
      "source_ids": ["ic-hmo-product-circular-2017-19"],
      "last_checked_at": "2026-07-08",
      "educational_summary": "The Insurance Commission circular frames HMO products as prepaid healthcare-service arrangements delivered through a selected provider network for a specified period, with possible benefit categories including inpatient, outpatient, emergency, annual physical exam, executive check-up, dental, maternity, and ancillary services.",
      "advice_boundary": "Use as a regulator-published product taxonomy only. Do not infer that any specific HMO plan includes every listed category."
    }
  ],
  "product_surfaces": [
    {
      "product_id": "philhealth-inpatient-benefits",
      "entity_id": "philhealth",
      "entity_type_snapshot": "public-payer",
      "product_name": "Inpatient Benefits",
      "product_aliases": ["PhilHealth inpatient benefits", "All Case Rates inpatient benefits"],
      "product_type": "public-benefit-category",
      "market_segments": ["public-member", "general"],
      "coverage_tags": ["public-benefit", "inpatient", "provider-network"],
      "evidence_level": "official",
      "source_ids": ["philhealth-benefits-page"],
      "extraction_status": "category-level",
      "last_checked_at": "2026-07-08",
      "educational_summary": "PhilHealth describes inpatient benefits as benefits paid to accredited health facilities through All Case Rates, with the case rate deducted from the member's bill before discharge.",
      "user_questions": [
        "Is the facility PhilHealth-accredited for the case?",
        "What documents does the facility require before discharge?",
        "What part of the bill remains outside the PhilHealth case rate?"
      ],
      "human_review_required": true,
      "advice_boundary": "Explain the public benefit category only. Do not decide eligibility, reimbursement, admissibility, or final bill responsibility."
    },
    {
      "product_id": "philhealth-outpatient-benefits",
      "entity_id": "philhealth",
      "entity_type_snapshot": "public-payer",
      "product_name": "Outpatient Benefits",
      "product_aliases": ["PhilHealth outpatient benefits", "Day surgery and outpatient packages"],
      "product_type": "public-benefit-category",
      "market_segments": ["public-member", "general"],
      "coverage_tags": ["public-benefit", "outpatient", "diagnostic", "provider-network"],
      "evidence_level": "official",
      "source_ids": ["philhealth-benefits-page"],
      "extraction_status": "category-level",
      "last_checked_at": "2026-07-08",
      "educational_summary": "PhilHealth lists outpatient benefit categories such as day surgeries, radiotherapy, hemodialysis, and outpatient blood transfusion, each with specific availability and claim rules.",
      "user_questions": [
        "Which outpatient benefit category is relevant?",
        "Is the service available at the accredited facility?",
        "Does the benefit have a session or day-limit rule?"
      ],
      "human_review_required": true,
      "advice_boundary": "Explain source-listed outpatient categories only. Do not calculate final benefits or advise where to undergo care."
    },
    {
      "product_id": "philhealth-z-benefits",
      "entity_id": "philhealth",
      "entity_type_snapshot": "public-payer",
      "product_name": "Z Benefits",
      "product_aliases": ["PhilHealth Z Benefits", "Z Benefit Packages"],
      "product_type": "public-benefit-category",
      "market_segments": ["public-member", "general"],
      "coverage_tags": ["public-benefit", "critical-illness", "inpatient", "provider-network"],
      "evidence_level": "official",
      "source_ids": ["philhealth-benefits-page"],
      "extraction_status": "category-level",
      "last_checked_at": "2026-07-08",
      "educational_summary": "PhilHealth lists Z Benefits for selected high-cost conditions and procedures, with condition-specific benefit amounts and selection criteria.",
      "user_questions": [
        "Is the condition or procedure listed under a Z Benefit package?",
        "Which contracted facility handles the package?",
        "What selection criteria and forms apply?"
      ],
      "human_review_required": true,
      "advice_boundary": "Explain that Z Benefits exist and require specific criteria. Do not determine patient eligibility or clinical suitability."
    },
    {
      "product_id": "maxicare-individual-family-hmo",
      "entity_id": "maxicare-healthcare",
      "entity_type_snapshot": "hmo",
      "product_name": "MyMaxicare Individual and Family HMO Plans",
      "product_aliases": ["MyMaxicare", "Maxicare individual and family plans"],
      "product_type": "individual-family-hmo",
      "market_segments": ["individual", "family"],
      "coverage_tags": ["inpatient", "outpatient", "preventive", "emergency", "provider-network", "cashless-access"],
      "evidence_level": "provider-published",
      "source_ids": ["maxicare-plans", "ic-hmo-product-circular-2017-19"],
      "extraction_status": "seed",
      "last_checked_at": "2026-07-08",
      "educational_summary": "Maxicare presents MyMaxicare as full-risk, full-coverage HMO plans for individuals and families, while the IC circular supplies the broader HMO product taxonomy.",
      "user_questions": [
        "Is the user shopping as an individual or family?",